{
  "dossiers": [
    {
      "case_id": "GD-HUN-EV-OEM-EXPORT-001",
      "completeness": {
        "by_domain": {
          "A1": 33.33,
          "A2": 100.0,
          "A3": 100.0,
          "A4": 100.0,
          "A5": 40.0,
          "A6": 20.0,
          "A7": 0.0,
          "A8": 0.0
        },
        "overall_pct": 49.17,
        "profile_weighted_pct": 100.0
      },
      "confidence_caps": {
        "by_domain": {
          "A1": "low",
          "A2": "high",
          "A3": "high",
          "A4": "high",
          "A5": "low",
          "A6": "low",
          "A7": "low",
          "A8": "low"
        },
        "overall": "low"
      },
      "country": "Hungary",
      "dossier_filename_original": "Gold Dossier \u2014 Hungary \u2014 China EV OEM Export Hub (LRF-1).md",
      "dossier_filename_public": "gd-hun-ev-oem-export-001.dossier.md",
      "evidence_ids_used": [
        "EV-2026-001",
        "EV-2026-002",
        "EV-2026-007",
        "EV-2026-008",
        "EV-2026-011",
        "EV-2026-012",
        "EV-2026-016",
        "EV-2026-017",
        "EV-2026-020",
        "EV-2026-023",
        "EV-2026-024",
        "EV-2026-025",
        "EV-2026-026",
        "EV-2026-027",
        "EV-2026-028",
        "EV-2026-029",
        "EV-2026-030",
        "EV-2026-031",
        "EV-2026-032"
      ],
      "indicator_ids_in_scope": [
        "IND-A1-REG-001",
        "IND-A1-REG-002",
        "IND-A2-GEO-001",
        "IND-A2-GEO-002",
        "IND-A2-GEO-003",
        "IND-A2-GEO-004",
        "IND-A2-GEO-005",
        "IND-A3-POL-001",
        "IND-A3-POL-002",
        "IND-A3-POL-003",
        "IND-A3-POL-004",
        "IND-A3-POL-005",
        "IND-A4-INF-001",
        "IND-A4-INF-002",
        "IND-A4-INF-003",
        "IND-A4-INF-004",
        "IND-A4-INF-005",
        "IND-A4-INF-006",
        "IND-A5-SUP-001",
        "IND-A5-SUP-002",
        "IND-A6-LAB-001"
      ],
      "overlay": "Balanced",
      "report_filename_original": "hungary.ev_oem_export.wp-ev-oem-export-1.1.balanced.report.v1.json",
      "report_filename_public": "gd-hun-ev-oem-export-001.report.v1.json",
      "scoring_status": "scoring not computed in v1",
      "sector": "EV",
      "slug": "gd-hun-ev-oem-export-001",
      "title": "Publish v0.1 - Hungary - China EV OEM Export Hub (LRF-1)",
      "weight_profile": "WP-EV-OEM-EXPORT-1.1"
    },
    {
      "case_id": "PD-MEX-EV-OEM-EXPORT-001",
      "completeness": {
        "by_domain": {
          "A1": 33.33,
          "A2": 100.0,
          "A3": 0.0,
          "A4": 100.0,
          "A5": 40.0,
          "A6": 20.0,
          "A7": 0.0,
          "A8": 0.0
        },
        "overall_pct": 36.67,
        "profile_weighted_pct": 100.0
      },
      "confidence_caps": {
        "by_domain": {
          "A1": "low",
          "A2": "high",
          "A3": "low",
          "A4": "high",
          "A5": "low",
          "A6": "low",
          "A7": "low",
          "A8": "low"
        },
        "overall": "low"
      },
      "country": "Mexico",
      "dossier_filename_original": "Pilot Dossier \u2014 Mexico \u2014 EV OEM Export Hub (USMCA) (LRF-1).md",
      "dossier_filename_public": "pd-mex-ev-oem-export-001.dossier.md",
      "evidence_ids_used": [
        "EV-2026-001",
        "EV-2026-002",
        "EV-2026-007",
        "EV-2026-008",
        "EV-2026-011",
        "EV-2026-012",
        "EV-2026-016",
        "EV-2026-017",
        "EV-2026-020",
        "EV-2026-023",
        "EV-2026-024",
        "EV-2026-025",
        "EV-2026-026",
        "EV-2026-027",
        "EV-2026-028",
        "EV-2026-029",
        "EV-2026-030",
        "EV-2026-031",
        "EV-2026-032"
      ],
      "indicator_ids_in_scope": [
        "IND-A1-REG-001",
        "IND-A1-REG-002",
        "IND-A2-GEO-001",
        "IND-A2-GEO-002",
        "IND-A2-GEO-003",
        "IND-A2-GEO-004",
        "IND-A2-GEO-005",
        "IND-A4-INF-001",
        "IND-A4-INF-002",
        "IND-A4-INF-003",
        "IND-A4-INF-004",
        "IND-A4-INF-005",
        "IND-A4-INF-006",
        "IND-A5-SUP-001",
        "IND-A5-SUP-002",
        "IND-A6-LAB-001"
      ],
      "overlay": "Balanced",
      "report_filename_original": "mexico.ev_oem_export.wp-ev-oem-export-1.1.balanced.report.v1.json",
      "report_filename_public": "pd-mex-ev-oem-export-001.report.v1.json",
      "scoring_status": "scoring not computed in v1",
      "sector": "EV",
      "slug": "pd-mex-ev-oem-export-001",
      "title": "Publish v0.1 - Mexico - EV OEM Export Hub (USMCA) (LRF-1)",
      "weight_profile": "WP-EV-OEM-EXPORT-1.1"
    },
    {
      "case_id": "PD-MYS-SEMI-OSAT-EXPORT-001",
      "completeness": {
        "by_domain": {
          "A1": 33.33,
          "A2": 100.0,
          "A3": 0.0,
          "A4": 100.0,
          "A5": 40.0,
          "A6": 20.0,
          "A7": 0.0,
          "A8": 0.0
        },
        "overall_pct": 36.67,
        "profile_weighted_pct": 100.0
      },
      "confidence_caps": {
        "by_domain": {
          "A1": "low",
          "A2": "high",
          "A3": "low",
          "A4": "high",
          "A5": "low",
          "A6": "low",
          "A7": "low",
          "A8": "low"
        },
        "overall": "low"
      },
      "country": "Malaysia",
      "dossier_filename_original": "Pilot Dossier \u2014 Malaysia \u2014 Semiconductor OSAT Export Hub (LRF-1).md",
      "dossier_filename_public": "pd-mys-semi-osat-export-001.dossier.md",
      "evidence_ids_used": [
        "EV-2026-001",
        "EV-2026-004",
        "EV-2026-007",
        "EV-2026-010",
        "EV-2026-011",
        "EV-2026-014",
        "EV-2026-016",
        "EV-2026-019",
        "EV-2026-022",
        "EV-2026-023",
        "EV-2026-024",
        "EV-2026-025",
        "EV-2026-026",
        "EV-2026-027",
        "EV-2026-028",
        "EV-2026-029",
        "EV-2026-030",
        "EV-2026-031",
        "EV-2026-032"
      ],
      "indicator_ids_in_scope": [
        "IND-A1-REG-001",
        "IND-A1-REG-002",
        "IND-A2-GEO-001",
        "IND-A2-GEO-002",
        "IND-A2-GEO-003",
        "IND-A2-GEO-004",
        "IND-A2-GEO-005",
        "IND-A4-INF-001",
        "IND-A4-INF-002",
        "IND-A4-INF-003",
        "IND-A4-INF-004",
        "IND-A4-INF-005",
        "IND-A4-INF-006",
        "IND-A5-SUP-001",
        "IND-A5-SUP-002",
        "IND-A6-LAB-001"
      ],
      "overlay": "Balanced",
      "report_filename_original": "malaysia.semi_osat_export.wp-semi-osat-export-1.1.balanced.report.v1.json",
      "report_filename_public": "pd-mys-semi-osat-export-001.report.v1.json",
      "scoring_status": "scoring not computed in v1",
      "sector": "SEMI",
      "slug": "pd-mys-semi-osat-export-001",
      "title": "Publish v0.1 - Malaysia - Semiconductor OSAT Export Hub (LRF-1)",
      "weight_profile": "WP-SEMI-OSAT-EXPORT-1.1"
    }
  ],
  "generated_at": "2026-02-10T23:46:39",
  "publish_mode": "option_a",
  "version": "v1"
}
